Título,Localización,Fecha,Salario,Formación,Salario_limpio,Salario_min,Salario_max,SalarioPromedio,España,CCAA,Fecha_parsed,Mes,Nivel
Montador de conductos en madrid,Madrid - España,17/04/2024,"10,000 - 30,000",Estudios primarios completos,10.000-30.000,10,30,20,SI,Madrid,2024-04-17,abril,Básico
Auxiliar administrativa,Tarragona - Cataluña - España,25/04/2024,23.000 - 26.000,Enseñanzas para la formación e…,23000-26000,23000,26000,24,SI,Cataluna,2024-04-25,abril,NA
Técnico auxiliar de enfermería (t.c.a.e),Valencia - Comunidad Valenciana - España,07/05/2024,"1.335,97 - 1.335,97",Enseñanzas de grado medio de formación…,1335.97-1335.97,1336,1336,16,SI,Comunidad Valenciana,2024-05-07,mayo,FP/Bachiller
Buscamos auxiliar de peluquería en cee,A Coruña - Galicia - España,27/08/2024,15.000 - 15.600,Estudios primarios completos,15000-15600,15000,15600,15,SI,Galicia,2024-08-27,agosto,Básico
Peón para industria metalúrgica,Palencia - Castilla Leon - España,29/05/2024,"22,000 - 24,000",Enseñanzas de grado medio de formación…,22.000-24.000,22,24,23,SI,Castilla Leon,2024-05-29,mayo,FP/Bachiller
Auxiliar de enfermeria,Valladolid - Castilla Leon - España,20/02/2025,16.000 - 17.000,Nivel de estudios desconocido,16000-17000,16000,17000,16,SI,Castilla Leon,2025-02-20,febrero,Desconocido
Senior engineer expert in sustainability,Valencia - Comunidad Valenciana - España,02/05/2024,20 - 40,Doctorado universitario.,20-40,20,40,30,SI,Comunidad Valenciana,2024-05-02,mayo,Doctorado
Encofradores 1ª - 2ª y peones especialistas,Asturias - España,24/05/2024,23.000 - 25.000,Estudios primarios incompletos,23000-25000,23000,25000,24,SI,Asturias,2024-05-24,mayo,Básico
Calderero oficial de 1ª de taller,Asturias - España,30/05/2024,26.000 - 29.000,Enseñanzas de grado superior de…,26000-29000,26000,29000,28,SI,Asturias,2024-05-30,mayo,FP/Bachiller
Fisioterapeuta,Madrid - España,05/06/2024,19.000 - 20.000,Enseñanzas universitarias de grado,19000-20000,19000,20000,20,SI,Madrid,2024-06-05,junio,Universidad
Tornero oficial 2ª,Madrid - España,04/04/2025,"22,000 - 24,000",Enseñanzas universitarias de grado,22.000-24.000,22,24,23,SI,Madrid,2025-04-04,abril,Universidad
"Operario departamento de corte, láser y doblado de chapa por control numérico.",Illes Balears - Baleares - España,04/04/2025,1.934.232 - 1.934.232,Estudios primarios completos,1934232-1934232,1934232,1934232,1934,SI,Baleares,2025-04-04,abril,Básico
Administració - base de dades,Cadiz - Andalucia - España,04/04/2025,"23.819,28 - 23.819,28",Enseñanzas universitarias de 1 er y 2º…,23819.28-23819.28,23819,23819,24,SI,Andalucia,2025-04-04,abril,Universidad
Enfermero-a,Madrid - España,04/04/2025,"22,000 - 24,000",Enseñanzas universitarias de grado,22.000-24.000,22,24,23,SI,Madrid,2025-04-04,abril,Universidad
Fisioterapeuta,Toledo - Castilla la Mancha - España,04/04/2025,9.000 - 15.000,Enseñanzas universitarias de grado,9000-15000,9000,15000,12,SI,Castilla la Mancha,2025-04-04,abril,Universidad
Oficial-a o técnico-a de mantenimiento industrial,Madrid - España,04/04/2025,24.000 - 2.400,Estudios primarios completos,24000-2400,24000,2400,13,SI,Madrid,2025-04-04,abril,Básico
Farmacéutico,Navarra - España,04/04/2025,"1.065 - 1,120",Enseñanzas universitarias de grado,1065-1.120,1065,1,6,SI,Navarra,2025-04-04,abril,Universidad
Ats-due,Madrid - España,04/04/2025,16.576 - 18.000,Enseñanzas universitarias de grado,16576-18000,16576,18000,17,SI,Madrid,2025-04-04,abril,Universidad
Peón de línea carretillero,Toledo - Castilla la Mancha - España,04/04/2025,15.000 - 17.000,Estudios primarios completos,15000-17000,15000,17000,16,SI,Castilla la Mancha,2025-04-04,abril,Básico
Terapeuta ocupacional,España,04/04/2025,Sin especificar,Nivel de estudios desconocido,,NA,NA,NA,SI,NA,2025-04-04,abril,Desconocido
Auxiliar de enfermería - gerocultor-a con discapacidad - centro de dia - residencia lleida,Burgos - Castilla Leon - España,04/04/2025,18.000 - 23.000,Estudios primarios completos,18000-23000,18000,23000,20,SI,Castilla Leon,2025-04-04,abril,Básico
Fisioterepauta residencia buendia,Madrid - España,04/04/2025,1.296 - 1.415 Programas para la formación e inserción…,NA,1296-1415,1296,1415,16,SI,Madrid,2025-04-04,abril,NA
Medico,Burgos - Castilla Leon - España,04/04/2025,23.560 - 24.000,Estudios primarios completos,23560-24000,23560,24000,24,SI,Castilla Leon,2025-04-04,abril,Básico
Gerocultor-a,Cadiz - Andalucia - España,04/04/2025,18.000 - 36.000,Enseñanzas de grado medio de formación…,18000-36000,18000,36000,27,SI,Andalucia,2025-04-04,abril,FP/Bachiller
Limpieza sector industrial-jornada parcial córdoba,Madrid - España,04/04/2025,18.000 - 24.000,Estudios primarios completos,18000-24000,18000,24000,21,SI,Madrid,2025-04-04,abril,Básico
Profesor para impartir matemáticas en la eso,Burgos - Castilla Leon - España,04/04/2025,16.000 - 17.000,Enseñanzas universitarias de 1 er y 2º…,16000-17000,16000,17000,16,SI,Castilla Leon,2025-04-04,abril,Universidad
Gerocultor-a para centro de mayores en san esteban de gormaz,Madrid - España,04/04/2025,15.000 - 27.000,Estudios primarios incompletos,15000-27000,15000,27000,21,SI,Madrid,2025-04-04,abril,Básico
Trabajador-a social,Pontevedra - Galicia - España,04/04/2025,21.000 - 25.000,Enseñanzas para la formación e…,21000-25000,21000,25000,23,SI,Galicia,2025-04-04,abril,NA
Camarero-a de pisos - club la santa - lanzarote,Alicante - Comunidad Valenciana - España,04/04/2025,12.000 - 15.000,Estudios primarios completos,12000-15000,12000,15000,14,SI,Comunidad Valenciana,2025-04-04,abril,Básico
Fisioterapeuta,Valladolid - Castilla Leon - España,04/04/2025,16.000 - 25.000,Nivel de estudios desconocido,16000-25000,16000,25000,20,SI,Castilla Leon,2025-04-04,abril,Desconocido
Mozo-a almacen- alcala la real (jaén),Leon - Castilla Leon - España,04/04/2025,11.026 - 11.030,Enseñanzas de grado medio de música y…,11026-11030,11026,11030,11,SI,Castilla Leon,2025-04-04,abril,FP/Bachiller
Auxiliar-gerocultor-a (h-m-x) centro de día san pedro del pinatar,Madrid - España,04/04/2025,34.000 - 34.000,Enseñanzas universitarias de 1 er y 2º…,34000-34000,34000,34000,34,SI,Madrid,2025-04-04,abril,Universidad
Enfermero-a para centro de mayores en san esteban de gormaz,Barcelona - Cataluña - España,04/04/2025,29.300 - 30.008,Enseñanzas universitarias de grado,29300-30008,29300,30008,30,SI,Cataluna,2025-04-04,abril,Universidad
Auxiliar de ayuda a domicilio con discapacidad (h-m-x) en bujalance (córdoba),Barcelona - Cataluña - España,04/04/2025,31.300 - 32.490,Doctorado universitario.,31300-32490,31300,32490,32,SI,Cataluna,2025-04-04,abril,Doctorado
Electromecánico-a grupos electrógenos - vitoria,Barcelona - Cataluña - España,04/04/2025,"19.719,86 - 19.719,86",Estudios primarios completos,19719.86-19719.86,19720,19720,20,SI,Cataluna,2025-04-04,abril,Básico
Mozo-a almacen- carretillero-a- lucena (cordoba),Barcelona - Cataluña - España,04/04/2025,20.000 - 30.000,Enseñanzas de bachillerato,20000-30000,20000,30000,25,SI,Cataluna,2025-04-04,abril,FP/Bachiller
Necesitamos limpiadoras para servicios en barcelona,Leon - Castilla Leon - España,04/04/2025,1.700 - 1.800,Enseñanzas universitarias de 1 er y 2º…,1700-1800,1700,1800,21,SI,Castilla Leon,2025-04-04,abril,Universidad
Asesor-a comercial pymes cantabria,Sevilla - Andalucia - España,04/04/2025,"1.380 - 16.575,96",Estudios primarios completos,1380-16575.96,1380,16576,9,SI,Andalucia,2025-04-04,abril,Básico
Consultor comercial de petfood con conocimientos del mercado mexicano,Vizcaya - Pais Vasco - España,04/04/2025,18.000 - 30.000,Enseñanzas de bachillerato,18000-30000,18000,30000,24,SI,Pais Vasco,2025-04-04,abril,FP/Bachiller
"Mecánico-a oficial 1ª. 2ª, 3ª - cartagena (murcia) interinidad",Valencia - Comunidad Valenciana - España,04/04/2025,20.000 - 30.000 Primera etapa de educación secundaria…,NA,20000-30000,20000,30000,25,SI,Comunidad Valenciana,2025-04-04,abril,NA
Vendedor-a tienda leroy merlín - maquinaria pequeña (marratxi),Malaga - Andalucia - España,04/04/2025,"23.753,28 - 23.753,28",Estudios primarios incompletos,23753.28-23753.28,23753,23753,24,SI,Andalucia,2025-04-04,abril,Básico
Vendedor-a tienda leroy merlín - maquinaria pequeña (palma de mallorca),Valencia - Comunidad Valenciana - España,04/04/2025,18.000 - 22.000,Enseñanzas de bachillerato,18000-22000,18000,22000,20,SI,Comunidad Valenciana,2025-04-04,abril,FP/Bachiller
Gerocultor-auxiliar de enfermería.,Barcelona - Cataluña - España,04/04/2025,"18,000 - 50,000",Enseñanzas universitarias de grado,18.000-50.000,18,50,34,SI,Cataluna,2025-04-04,abril,Universidad
Camarero-a 40 horas a la semana - club la santa - lanzarote,Madrid - España,04/04/2025,"22,000 - 24,000",Enseñanzas universitarias de grado,22.000-24.000,22,24,23,SI,Madrid,2025-04-04,abril,Universidad
"Mecánico-a 1ª, 2ª o 3ª maquinaria - porriño (vigo)",Cadiz - Andalucia - España,04/04/2025,21.000 - 22.000 Programas para la formación e inserción…,NA,21000-22000,21000,22000,22,SI,Andalucia,2025-04-04,abril,NA
Moza de almacén,Huelva - Andalucia - España,04/04/2025,7.200 - 8.400,Enseñanzas de bachillerato,7200-8400,7200,8400,8,SI,Andalucia,2025-04-04,abril,FP/Bachiller
Gerocultores para residencia de mayores,Zaragoza - Aragon - España,04/04/2025,18.000 - 22.300,Nivel de estudios desconocido,18000-22300,18000,22300,20,SI,Aragon,2025-04-04,abril,Desconocido
Buscamos barbero(x) en cee,Caceres - Extremadura - España,04/04/2025,18.000 - 22.300,Nivel de estudios desconocido,18000-22300,18000,22300,20,SI,Extremadura,2025-04-04,abril,Desconocido
Mecanico vehiculos industriales,Caceres - Extremadura - España,04/04/2025,18.000 - 22.300,Nivel de estudios desconocido,18000-22300,18000,22300,20,SI,Extremadura,2025-04-04,abril,Desconocido
Ayudante camarero-a 40 horas a la semana - club la santa - lanzarote,Murcia - España,04/04/2025,18.000 - 22.300,Nivel de estudios desconocido,18000-22300,18000,22300,20,SI,Murcia,2025-04-04,abril,Desconocido
Tecnico informatico-audiovisual-redes,Barcelona - Cataluña - España,04/04/2025,"18,000 - 50,000",Enseñanzas universitarias de grado,18.000-50.000,18,50,34,SI,Cataluna,2025-04-04,abril,Universidad
"Gerente de ventas, representante de ventas",Barcelona - Cataluña - España,04/04/2025,"18,000 - 50,000",Enseñanzas universitarias de grado,18.000-50.000,18,50,34,SI,Cataluna,2025-04-04,abril,Universidad
Pintor de coches,Murcia - España,04/04/2025,16.576 - 16.576,Enseñanzas universitarias de grado,16576-16576,16576,16576,17,SI,Murcia,2025-04-04,abril,Universidad
Mozo de almacén,Malaga - Andalucia - España,04/04/2025,1.300 - 1.800,Estudios primarios completos,1300-1800,1300,1800,19,SI,Andalucia,2025-04-04,abril,Básico
Oficial albañil,A Coruña - Galicia - España,04/04/2025,"24,019 - 24,019",Enseñanzas universitarias oficiales de…,24.019-24.019,24,24,24,SI,Galicia,2025-04-04,abril,Universidad
Gerocultora,Madrid - España,04/04/2025,17.000 - 18.000,Enseñanzas para la formación e…,17000-18000,17000,18000,18,SI,Madrid,2025-04-04,abril,NA
Vendedor-a tienda leroy merlín - maquinaria pequeña (barajas),Zaragoza - Aragon - España,04/04/2025,Sin especificar,Otros tipos de formación,,NA,NA,NA,SI,Aragon,2025-04-04,abril,Otros
Técnico eléctrico,Huesca - Aragon - España,04/04/2025,Sin especificar,Fp de grado superior y equivalentes…,,NA,NA,NA,SI,Aragon,2025-04-04,abril,FP/Bachiller
Mecanico,Asturias - España,04/04/2025,Sin especificar,Otros tipos de formación,,NA,NA,NA,SI,Asturias,2025-04-04,abril,Otros
Enfermero-a due con discapacidad - oliana,Asturias - España,04/04/2025,Sin especificar,Otros tipos de formación,,NA,NA,NA,SI,Asturias,2025-04-04,abril,Otros
Medico,Pontevedra - Galicia - España,04/04/2025,Sin especificar,Otros tipos de formación,,NA,NA,NA,SI,Galicia,2025-04-04,abril,Otros
Enfermer@,España,04/04/2025,Sin especificar,Otros tipos de formación,,NA,NA,NA,SI,NA,2025-04-04,abril,Otros
Ayudante de camarero-a 20 horas a la semana - club la santa - lanzarote,España,04/04/2025,Sin especificar,Enseñanzas de grado superior de…,,NA,NA,NA,SI,NA,2025-04-04,abril,FP/Bachiller
Cuidadores-as profesionales para personas con discapacidad,España,04/04/2025,36.000 - 39.000,Doctorado universitario.,36000-39000,36000,39000,38,SI,NA,2025-04-04,abril,Doctorado
Operaria-o de cadena de montaje,Valencia - Comunidad Valenciana - España,04/04/2025,10.000 - 13.999 Primera etapa de educación secundaria…,NA,10000-13999,10000,13999,12,SI,Comunidad Valenciana,2025-04-04,abril,NA
Técnico aplicador legionella-control de plagas,Madrid - España,04/04/2025,Sin especificar,Sin estudios,,NA,NA,NA,SI,Madrid,2025-04-04,abril,Sin estudios
Programa comercial recien titulados para futuros delegados,Sevilla - Andalucia - España,04/04/2025,Sin especificar,Estudios primarios incompletos,,NA,NA,NA,SI,Andalucia,2025-04-04,abril,Básico
"Pintor industrial - recubrimiento en polvo, alemania",Girona - Cataluña - España,04/04/2025,Sin especificar,Sin estudios,,NA,NA,NA,SI,Cataluna,2025-04-04,abril,Sin estudios
Dependiente en tienda de electrodomésticos,Barcelona - Cataluña - España,04/04/2025,Sin especificar,Estudios primarios incompletos,,NA,NA,NA,SI,Cataluna,2025-04-04,abril,Básico
Docente medioambiente,Asturias - España,04/04/2025,Sin especificar,Otros tipos de formación,,NA,NA,NA,SI,Asturias,2025-04-04,abril,Otros
Técnico electrónico junior para línea de montaje smt,Illes Balears - Baleares - España,04/04/2025,Sin especificar,Sin estudios,,NA,NA,NA,SI,Baleares,2025-04-04,abril,Sin estudios
"Operario-a soldador-a tig, mig",A Coruña - Galicia - España,04/04/2025,Sin especificar,Otros tipos de formación,,NA,NA,NA,SI,Galicia,2025-04-04,abril,Otros
Mozo-a almacén,Pontevedra - Galicia - España,04/04/2025,Sin especificar,Otros tipos de formación,,NA,NA,NA,SI,Galicia,2025-04-04,abril,Otros
Albañiles oficiales 1ª categoría,Pontevedra - Galicia - España,04/04/2025,Sin especificar,Enseñanzas de grado medio de formación…,,NA,NA,NA,SI,Galicia,2025-04-04,abril,FP/Bachiller
Conductores para suministro a tiendas y supermercados,Lugo - Galicia - España,04/04/2025,Sin especificar,Otros tipos de formación,,NA,NA,NA,SI,Galicia,2025-04-04,abril,Otros
"Soldador de mig-mag y tig, alemania",A Coruña - Galicia - España,04/04/2025,Sin especificar,Enseñanzas universitarias oficiales de…,,NA,NA,NA,SI,Galicia,2025-04-04,abril,Universidad
Tecnico auxiliar de presupuestos tecnicos-ofertas,A Coruña - Galicia - España,04/04/2025,Sin especificar,Enseñanzas de grado medio de formación…,,NA,NA,NA,SI,Galicia,2025-04-04,abril,FP/Bachiller
Peon de obra palma de mallorca,A Coruña - Galicia - España,04/04/2025,Sin especificar,Otros tipos de formación,,NA,NA,NA,SI,Galicia,2025-04-04,abril,Otros
Auxiliar de enfermería - gerocultor-a con discapacidad - oliana,Sevilla - Andalucia - España,04/04/2025,Sin especificar,Estudios primarios incompletos,,NA,NA,NA,SI,Andalucia,2025-04-04,abril,Básico
Auxiliar administrativo,A Coruña - Galicia - España,04/04/2025,Sin especificar,Otros tipos de formación,,NA,NA,NA,SI,Galicia,2025-04-04,abril,Otros
Programa desarrollo comercial futuros delegados málaga,A Coruña - Galicia - España,04/04/2025,Sin especificar,Otros tipos de formación,,NA,NA,NA,SI,Galicia,2025-04-04,abril,Otros
"Mecánico-a 1ª, 2ª o 3ª maquinaria - ciempozuelos",Lugo - Galicia - España,04/04/2025,Sin especificar,Enseñanzas de grado medio de formación…,,NA,NA,NA,SI,Galicia,2025-04-04,abril,FP/Bachiller
Pintor de coches,Lugo - Galicia - España,04/04/2025,Sin especificar,Otros tipos de formación,,NA,NA,NA,SI,Galicia,2025-04-04,abril,Otros
Necesario médico en valdestillas,Pontevedra - Galicia - España,04/04/2025,Sin especificar,Otros tipos de formación,,NA,NA,NA,SI,Galicia,2025-04-04,abril,Otros
Peón albañil,Asturias - España,04/04/2025,Sin especificar,Otros tipos de formación,,NA,NA,NA,SI,Asturias,2025-04-04,abril,Otros
Técnico en control de plagas y legionella,Valencia - Comunidad Valenciana - España,04/04/2025,14.000 - 17.999 Primera etapa de educación secundaria…,NA,14000-17999,14000,17999,16,SI,Comunidad Valenciana,2025-04-04,abril,NA
Se buscan monitores-as escolares,Sevilla - Andalucia - España,04/04/2025,24.000 - 29.999 Primera etapa de educación secundaria…,NA,24000-29999,24000,29999,27,SI,Andalucia,2025-04-04,abril,NA
Personal multiservicios,Lleida - Cataluña - España,04/04/2025,Sin especificar,Sin estudios,,NA,NA,NA,SI,Cataluna,2025-04-04,abril,Sin estudios
Monitor-a para personas con discapacidad,Alicante - Comunidad Valenciana - España,04/04/2025,Sin especificar,Enseñanzas universitarias oficiales de…,,NA,NA,NA,SI,Comunidad Valenciana,2025-04-04,abril,Universidad
"Personal de limpieza en locales y oficinas, patios y cristales. en madrid y extrarradio ( alcorcon,…",Alicante - Comunidad Valenciana - España,04/04/2025,Sin especificar,Enseñanzas de bachillerato,,NA,NA,NA,SI,Comunidad Valenciana,2025-04-04,abril,FP/Bachiller
"Editor video, con inglés y dominio de internet",A Coruña - Galicia - España,04/04/2025,Sin especificar,Doctorado universitario.,,NA,NA,NA,SI,Galicia,2025-04-04,abril,Doctorado
Early childhood educators for nurseries in ireland,Pontevedra - Galicia - España,04/04/2025,Sin especificar,Otros tipos de formación,,NA,NA,NA,SI,Galicia,2025-04-04,abril,Otros
Chef en dubai,A Coruña - Galicia - España,04/04/2025,Sin especificar,Otros tipos de formación,,NA,NA,NA,SI,Galicia,2025-04-04,abril,Otros
Tecnico superior en estetica o auxiliar medicina estetica,A Coruña - Galicia - España,04/04/2025,Sin especificar,Otros tipos de formación,,NA,NA,NA,SI,Galicia,2025-04-04,abril,Otros
Montador de conductos en valladolid,Lugo - Galicia - España,04/04/2025,Sin especificar,Otros tipos de formación,,NA,NA,NA,SI,Galicia,2025-04-04,abril,Otros
Carpintero de madera,Lugo - Galicia - España,04/04/2025,Sin especificar,Otros tipos de formación,,NA,NA,NA,SI,Galicia,2025-04-04,abril,Otros
Auxiliar administrativos,Pontevedra - Galicia - España,04/04/2025,Sin especificar,Otros tipos de formación,,NA,NA,NA,SI,Galicia,2025-04-04,abril,Otros
Dependiente dependienta camarer@ horno de pan con degustación,A Coruña - Galicia - España,04/04/2025,Sin especificar,Otros tipos de formación,,NA,NA,NA,SI,Galicia,2025-04-04,abril,Otros
Técnico laboral para asesoría,Lugo - Galicia - España,04/04/2025,Sin especificar,Otros tipos de formación,,NA,NA,NA,SI,Galicia,2025-04-04,abril,Otros
Montador de conductos en león,A Coruña - Galicia - España,04/04/2025,Sin especificar,Otros tipos de formación,,NA,NA,NA,SI,Galicia,2025-04-04,abril,Otros
"Empleados de venta de cupones, en general",Lugo - Galicia - España,04/04/2025,Sin especificar,Otros tipos de formación,,NA,NA,NA,SI,Galicia,2025-04-04,abril,Otros
Monitores de educación y tiempo libre,A Coruña - Galicia - España,04/04/2025,Sin especificar,Primera etapa de educación secundaria…,,NA,NA,NA,SI,Galicia,2025-04-04,abril,NA
Auxiliar de limpieza. ref. sxsdl.,Madrid - España,04/04/2025,Sin especificar,Sin estudios,,NA,NA,NA,SI,Madrid,2025-04-04,abril,Sin estudios
"Conductores-operadores de maquinaria forestal con motor, en general",Lugo - Galicia - España,04/04/2025,Sin especificar,Otros tipos de formación,,NA,NA,NA,SI,Galicia,2025-04-04,abril,Otros
Informático-a,A Coruña - Galicia - España,04/04/2025,Sin especificar,Otros tipos de formación,,NA,NA,NA,SI,Galicia,2025-04-04,abril,Otros
Técnicos de información turística,A Coruña - Galicia - España,04/04/2025,Sin especificar,Otros tipos de formación,,NA,NA,NA,SI,Galicia,2025-04-04,abril,Otros
Teleoperadores,A Coruña - Galicia - España,04/04/2025,Sin especificar,Otros tipos de formación,,NA,NA,NA,SI,Galicia,2025-04-04,abril,Otros
"Empleados de venta de cupones, en general",Lugo - Galicia - España,04/04/2025,Sin especificar,Otros tipos de formación,,NA,NA,NA,SI,Galicia,2025-04-04,abril,Otros
"Analista programador-a abap, 100% en remoto",España,04/04/2025,Sin especificar,Sin estudios,,NA,NA,NA,SI,NA,2025-04-04,abril,Sin estudios
Agentes de seguros,Pontevedra - Galicia - España,04/04/2025,Sin especificar,Otros tipos de formación,,NA,NA,NA,SI,Galicia,2025-04-04,abril,Otros
Instaladores-ajustadores de instalaciones de refrigeración y aire acondicionado,Pontevedra - Galicia - España,04/04/2025,Sin especificar,Otros tipos de formación,,NA,NA,NA,SI,Galicia,2025-04-04,abril,Otros
Enfermeros de cuidados generales,Lugo - Galicia - España,04/04/2025,Sin especificar,Enseñanzas universitarias oficiales de…,,NA,NA,NA,SI,Galicia,2025-04-04,abril,Universidad
Empleados de centros de recreo,Ourense - Galicia - España,04/04/2025,Sin especificar,Otros tipos de formación,,NA,NA,NA,SI,Galicia,2025-04-04,abril,Otros
Dependientes de artículos de ferretería,Pontevedra - Galicia - España,04/04/2025,Sin especificar,Otros tipos de formación,,NA,NA,NA,SI,Galicia,2025-04-04,abril,Otros
Terapeutas ocupacionales,Ourense - Galicia - España,04/04/2025,Sin especificar,Otros tipos de formación,,NA,NA,NA,SI,Galicia,2025-04-04,abril,Otros
"Mecánicos-ajustadores del automóvil, en general (turismos y furgonetas)",Lugo - Galicia - España,04/04/2025,Sin especificar,Otros tipos de formación,,NA,NA,NA,SI,Galicia,2025-04-04,abril,Otros
"Empleados de venta de cupones, en general",Pontevedra - Galicia - España,04/04/2025,Sin especificar,Otros tipos de formación,,NA,NA,NA,SI,Galicia,2025-04-04,abril,Otros
"Técnicos administrativos, en general",A Coruña - Galicia - España,04/04/2025,Sin especificar,Primera etapa de educación secundaria…,,NA,NA,NA,SI,Galicia,2025-04-04,abril,NA
Vigilantes de seguridad,A Coruña - Galicia - España,04/04/2025,Sin especificar,Otros tipos de formación,,NA,NA,NA,SI,Galicia,2025-04-04,abril,Otros
Asistentes domiciliarios,A Coruña - Galicia - España,04/04/2025,Sin especificar,Otros tipos de formación,,NA,NA,NA,SI,Galicia,2025-04-04,abril,Otros
"Empleados de venta de cupones, en general",Pontevedra - Galicia - España,04/04/2025,Sin especificar,Otros tipos de formación,,NA,NA,NA,SI,Galicia,2025-04-04,abril,Otros
"Empleados de venta de cupones, en general",Lugo - Galicia - España,04/04/2025,Sin especificar,Otros tipos de formación,,NA,NA,NA,SI,Galicia,2025-04-04,abril,Otros
Azafata-o estanco vilanova i la geltru 2100€,Barcelona - Cataluña - España,04/04/2025,Sin especificar,Estudios primarios incompletos,,NA,NA,NA,SI,Cataluna,2025-04-04,abril,Básico
"Técnicos administrativos, en general",A Coruña - Galicia - España,04/04/2025,Sin especificar,Primera etapa de educación secundaria…,,NA,NA,NA,SI,Galicia,2025-04-04,abril,NA
Taquilleros,Lugo - Galicia - España,04/04/2025,Sin especificar,Otros tipos de formación,,NA,NA,NA,SI,Galicia,2025-04-04,abril,Otros
"Empleados de venta de cupones, en general",Lugo - Galicia - España,04/04/2025,Sin especificar,Otros tipos de formación,,NA,NA,NA,SI,Galicia,2025-04-04,abril,Otros
Logopedas,Lugo - Galicia - España,04/04/2025,Sin especificar,Otros tipos de formación,,NA,NA,NA,SI,Galicia,2025-04-04,abril,Otros
Educadores de menores,Lugo - Galicia - España,04/04/2025,Sin especificar,Enseñanzas universitarias oficiales de…,,NA,NA,NA,SI,Galicia,2025-04-04,abril,Universidad
Conductor de tractor con remolque,Pontevedra - Galicia - España,04/04/2025,Sin especificar,Otros tipos de formación,,NA,NA,NA,SI,Galicia,2025-04-04,abril,Otros
Camarero-a centro hospitalario,Madrid - España,04/04/2025,Sin especificar,Estudios primarios incompletos,,NA,NA,NA,SI,Madrid,2025-04-04,abril,Básico
"Empleados de venta de cupones, en general",Pontevedra - Galicia - España,04/04/2025,Sin especificar,Otros tipos de formación,,NA,NA,NA,SI,Galicia,2025-04-04,abril,Otros
"Camareros, en general",Lugo - Galicia - España,04/04/2025,Sin especificar,Otros tipos de formación,,NA,NA,NA,SI,Galicia,2025-04-04,abril,Otros
"Empleados de venta de cupones, en general",Pontevedra - Galicia - España,04/04/2025,Sin especificar,Otros tipos de formación,,NA,NA,NA,SI,Galicia,2025-04-04,abril,Otros
"Fisioterapeutas, en general",Lugo - Galicia - España,04/04/2025,Sin especificar,Otros tipos de formación,,NA,NA,NA,SI,Galicia,2025-04-04,abril,Otros
"Camareros, en general",Pontevedra - Galicia - España,04/04/2025,Sin especificar,Otros tipos de formación,,NA,NA,NA,SI,Galicia,2025-04-04,abril,Otros
Ayudante-a de cocina,Lugo - Galicia - España,04/04/2025,Sin especificar,Otros tipos de formación,,NA,NA,NA,SI,Galicia,2025-04-04,abril,Otros
Turno mañana captador-a cruz roja 1.100€,Madrid - España,04/04/2025,Sin especificar,Estudios primarios incompletos,,NA,NA,NA,SI,Madrid,2025-04-04,abril,Básico
"Cuidadores de personas con discapacidad y-o dependencia, en instituciones",A Coruña - Galicia - España,04/04/2025,Sin especificar,Enseñanzas universitarias oficiales de…,,NA,NA,NA,SI,Galicia,2025-04-04,abril,Universidad
"Empleados de venta de cupones, en general",Lugo - Galicia - España,04/04/2025,Sin especificar,Otros tipos de formación,,NA,NA,NA,SI,Galicia,2025-04-04,abril,Otros
"Camareros, en general",Pontevedra - Galicia - España,04/04/2025,Sin especificar,Otros tipos de formación,,NA,NA,NA,SI,Galicia,2025-04-04,abril,Otros
Técnicos en control de calidad en industrias alimentarias,Lugo - Galicia - España,04/04/2025,Sin especificar,Primera etapa de educación secundaria…,,NA,NA,NA,SI,Galicia,2025-04-04,abril,NA
"Mecánicos-ajustadores de camiones y autobuses, en general",Ourense - Galicia - España,04/04/2025,Sin especificar,Otros tipos de formación,,NA,NA,NA,SI,Galicia,2025-04-04,abril,Otros
Enfermeros de cuidados generales,Pontevedra - Galicia - España,04/04/2025,Sin especificar,Enseñanzas universitarias oficiales de…,,NA,NA,NA,SI,Galicia,2025-04-04,abril,Universidad
Agentes comerciales,Lugo - Galicia - España,04/04/2025,Sin especificar,Otros tipos de formación,,NA,NA,NA,SI,Galicia,2025-04-04,abril,Otros
